{
  "schema": "write-lease/v1",
  "lease_id": "lease-0000",
  "lease_state": "running",
  "channel_scope_id": "<channel-id>",
  "origin_message_id": "<origin-message-id>",
  "root_run_id": "<run-id>",
  "child_session_key": "<session-key>",
  "generation": 1,
  "epoch": 1,
  "protects_status_artifact": {
    "path": "<artifact-root>/lane-0000/status.json",
    "device": "<device-id>",
    "inode": "<inode-id>"
  },
  "runtime_owner": {
    "runtime_run_id": "runtime-run-0000",
    "embedded_session_id": "<session-key>",
    "provider_authenticated": true,
    "heartbeat_at": "<t4>"
  },
  "locked_write_sets": [
    {
      "real_path": "<worktree-root>/scripts/",
      "branch": "task/example-project-build-validation",
      "lock_id": "<lock-id>",
      "exclusive_lock_held": true
    },
    {
      "real_path": "<worktree-root>/tests/",
      "branch": "task/example-project-build-validation",
      "lock_id": "<lock-id-2>",
      "exclusive_lock_held": true
    }
  ],
  "acquired_at": "<t1>",
  "released_at": null,
  "reacquired": "idempotent-same-run",
  "successor_record": null
}
